{
  "case_id": "PER-USB-001",
  "case_name": "Peripheral USB Storage Policy",
  "module": "peripheral",
  "flow": [
    {
      "name": "launch_app",
      "ref": "app.launch",
      "params": {
        "timeout_sec": 20
      }
    },
    {
      "name": "open_peripheral_manage",
      "ref": "navigation.open_page",
      "params": {
        "page_id": "peripheral-manage"
      }
    },
    {
      "name": "update_usb_storage_policy",
      "ref": "entity.update",
      "params": {
        "domain": "peripheral",
        "entity": "usb_storage_policy",
        "data": {
          "policy": "read_only"
        }
      }
    }
  ],
  "assertions": [],
  "result_policy": {
    "allow_unknown": true,
    "stop_on_failure": true
  },
  "notes": [
    "Getter-backed USB storage policy assertion will be added later."
  ]
}
