{
  "case_id": "SET-PASSWORD-001",
  "case_name": "工具密码设置流程",
  "module": "tool-settings",
  "steps": [
    {
      "name": "输入新密码和确认密码",
      "type": "mcp_action",
      "action": "set_tool_password",
      "params": {
        "current_password": "",
        "new_password": "1234",
        "confirm_password": "1234"
      },
      "expected": "密码保存成功"
    }
  ],
  "notes": [
    "建议后续补充错误密码、不一致密码两条负向用例。"
  ]
}
